search_term,id,urn,profile_link,profile_id,name,first_name,last_name,location,headline,estimated_age,followers,connections,mutuals,is_connection,premium,creator,influencer,open_to_work,is_hiring,current_position,current_company,past_company_1,past_company_2,school_1,school_2,top_skill_1,top_skill_2,top_skill_3,bio,experiences,schools,skills,certifications,languages,emails_in_bio,potential_emails,profile_photo,banner_photo,connection_created_at,connection_email,connection_phone_numbers,connection_websites,connection_street_address,connection_birthday
manual,ACoAAB4XMuABf_7Q_XrErD_SPu6ovmWSJENFyV0,504836832,https://www.linkedin.com/in/mostafao,mostafao,Mostafa Othman,Mostafa,Othman,Greater Tokyo Area,Robotics Software Engineer,29.0,1281,1283,0,no,False,False,False,False,False,Robotics software engineer,Rapyuta Robotics,,,Innopolis University,Nile University - NU,SolidWorks,Engineering,Arduino,"As an emerging Robotics Software Engineer, I've honed my skills through various internships and competitive experiences. I had the privilege to work at Rapyuta Robotics in Tokyo, where I was actively involved in diagnosing and rectifying issues during robot deployment, streamlining deployment workflows, and enhancing product, process, and operations.

Throughout my journey, I have cultivated a unique skill set in managing complex systems, with a focus on orchestrating bilateral communication for the teleoperation of robotics manipulators. My academic pursuits have delved deep into the intersection of Robotics and computer vision, providing me with profound insights into Robot Reinforcement Learning, Developmental Robotics, and Deep Generative Models.

Challenges have played a vital role in my learning and growth, serving as practical platforms for applying my skills. One notable challenging project was the 'Tele-operation and Control of Kuka iiwa Robotic Arm using Haptic Device and Force Feedback for Resilience Assembly of Peg-in-Hole Task', where I explored various fields and platforms, ranging from computer vision to fully autonomous systems.

I am well-versed in utilizing a range of technical platforms, including Unity3D, MATLAB, SOLIDWORKS, Arduino, ROS, Python, C++, C#, Git, Docker, and TensorFlow. These tools have empowered me to tackle complex challenges and develop innovative solutions.

In addition to my technical expertise, I strongly believe in the power of effective leadership and teamwork. During my tenure as the Chairman of the Robotronics student club at my university, I mentored teams for various competitions and gained valuable management experience while overseeing numerous projects.

As I continue to navigate this exciting career path, I am driven to apply my passion and skills to cutting-edge robotics and software development projects. I am committed to expanding my knowledge and proficiency in this rapidly evolving field, contributing to the advancement of robotics technology and creating a positive impact in the lives of individuals and communities.","[{'start_date': '2022-12-06', 'end_date': None, 'duration': '2 yrs 5 mos', 'title': 'Robotics software engineer', 'company': 'Rapyuta Robotics', 'location': 'Tokyo, Japan · On-site', 'emp_type': None}]","[{'start_date': '2020-09-06', 'end_date': '2022-07-06', 'school': 'Innopolis University', 'degree': ""Master's degree, Robotics and Computer Vision""}, {'start_date': '2017-04-06', 'end_date': '2020-04-06', 'school': 'Nile University - NU', 'degree': 'Bachelor of Engineering - BE, Mechatronics, Robotics, and Automation Engineering'}, {'start_date': '2014-04-06', 'end_date': '2017-04-06', 'school': 'Higher Technological Institute', 'degree': 'Mechatronics, Robotics, and Automation Engineering'}]","[{'name': 'Forklift Operation', 'endorsements': 0, 'passed_assessment': None}, {'name': 'Forklift Training', 'endorsements': 0, 'passed_assessment': None}, {'name': 'Field Applications', 'endorsements': 0, 'passed_assessment': None}, {'name': 'Robot operation', 'endorsements': 0, 'passed_assessment': None}, {'name': 'Computer Vision', 'endorsements': 0, 'passed_assessment': None}, {'name': 'Robotics', 'endorsements': 0, 'passed_assessment': None}, {'name': 'Augmented Reality (AR)', 'endorsements': 2, 'passed_assessment': None}, {'name': 'Learning from demonestration', 'endorsements': 2, 'passed_assessment': None}, {'name': 'Robot Operating System (ROS)', 'endorsements': 3, 'passed_assessment': None}, {'name': 'R&D', 'endorsements': 6, 'passed_assessment': None}, {'name': 'Virtual Reality (VR)', 'endorsements': 0, 'passed_assessment': None}, {'name': 'Engineering', 'endorsements': 8, 'passed_assessment': None}, {'name': 'Manufacturing', 'endorsements': 6, 'passed_assessment': None}, {'name': 'Research', 'endorsements': 6, 'passed_assessment': None}, {'name': 'Continuous Improvement', 'endorsements': 3, 'passed_assessment': None}, {'name': 'Project Planning', 'endorsements': 3, 'passed_assessment': None}, {'name': 'Docker', 'endorsements': 0, 'passed_assessment': None}, {'name': 'Unity', 'endorsements': 0, 'passed_assessment': None}, {'name': 'Git', 'endorsements': 0, 'passed_assessment': None}, {'name': 'Matlab', 'endorsements': 3, 'passed_assessment': None}, {'name': 'Reinforcement Learning', 'endorsements': 0, 'passed_assessment': None}, {'name': 'CNC Operation', 'endorsements': 4, 'passed_assessment': None}, {'name': 'Laser Cutting', 'endorsements': 3, 'passed_assessment': None}, {'name': 'SolidWorks', 'endorsements': 12, 'passed_assessment': True}, {'name': 'ANSYS', 'endorsements': 0, 'passed_assessment': None}, {'name': 'Arduino', 'endorsements': 8, 'passed_assessment': None}, {'name': 'Microsoft Office', 'endorsements': 7, 'passed_assessment': None}, {'name': 'Microsoft Excel', 'endorsements': 3, 'passed_assessment': None}, {'name': 'SOLIDWORKS', 'endorsements': 0, 'passed_assessment': True}, {'name': 'Team Leadership', 'endorsements': 8, 'passed_assessment': None}, {'name': 'Management', 'endorsements': 2, 'passed_assessment': None}, {'name': 'Teamwork', 'endorsements': 7, 'passed_assessment': None}, {'name': 'Leadership', 'endorsements': 3, 'passed_assessment': None}]","[{'title': 'Introduction to Augmented Reality and ARCore', 'issuer': 'CG', 'date_issued': 'Apr 2020', 'cert_id': None, 'cert_link': 'https://coursera.org/share/d53fe87f8bce5fce3e099e891c638bc2'}, {'title': 'Programming for Everybody (Getting Started with Python)', 'issuer': 'University of Michigan | Coursera', 'date_issued': 'Apr 2020', 'cert_id': None, 'cert_link': 'https://coursera.org/share/da92f5f71d1a9f2fcd3d8dafc4ba5bd3'}, {'title': 'Coding Intro', 'issuer': 'IBM', 'date_issued': None, 'cert_id': None, 'cert_link': 'https://www.credly.com/badges/069aa2ee-6165-49d6-9034-75d288daba0f/public_url'}, {'title': 'Google cloud skills', 'issuer': 'Google Career Certificates', 'date_issued': None, 'cert_id': None, 'cert_link': 'https://www.cloudskillsboost.google/public_profiles/f937c0b1-faf7-47f1-bcc6-db0b82deac08'}, {'title': 'Internet of Things Intro', 'issuer': 'IBM', 'date_issued': None, 'cert_id': None, 'cert_link': 'https://www.credly.com/badges/a173b3be-6a8c-4d11-b6e1-be558d71cc84/public_url'}]","['Arabic', 'English']",,,https://media.licdn.com/dms/image/v2/C4E03AQEFxaLCs1H33Q/profile-displayphoto-shrink_800_800/profile-displayphoto-shrink_800_800/0/1653839569141?e=1749686400&v=beta&t=W92YcEB5HfP_2e1JOotiTDPFBiNwe6PktBAmM27ALjw,,,,[],['mostafa-metwaly.github.io'],,
manual,ACoAADXEX44BGYqWFEixAF8YA6rKMIR5u4YZy_4,902061966,https://www.linkedin.com/in/lenar-evstafev,lenar-evstafev,Lenar Evstafev,Lenar,Evstafev,Canada,"Frontend Developer (JavaScript, React) | Telegram: @Lenar_E",31.0,447,447,0,no,False,False,False,False,False,Frontend Developer,Sravni.ru,Webinar,Ak Bars Digital Technologies,Innopolis University,Kazan Energy College,TypeScript,Redux,HTML,"Hello! I am results-oriented Frontend Developer with 5 years of experience, specializing in building responsive and user-friendly web applications. Proficient in HTML, CSS, JavaScript, and React, and have experience optimizing performance and enhancing user interfaces to meet the demands of modern web development.","[{'start_date': '2023-09-06', 'end_date': None, 'duration': '1 yr 8 mos', 'title': 'Frontend Developer', 'company': 'Sravni.ru', 'location': 'Remote', 'emp_type': None}, {'start_date': '2023-03-06', 'end_date': '2023-08-06', 'duration': '6 mos', 'title': 'Frontend Developer', 'company': 'Webinar', 'location': 'Москва, Россия · Remote', 'emp_type': 'full-time'}, {'start_date': '2020-09-06', 'end_date': '2023-02-06', 'duration': '2 yrs 6 mos', 'title': 'Frontend Engineer', 'company': 'Ak Bars Digital Technologies', 'location': 'Казань, Республика Татарстан, Россия · Remote', 'emp_type': 'full-time'}, {'start_date': '2019-02-06', 'end_date': '2020-08-06', 'duration': '1 yr 7 mos', 'title': 'Frontend Developer', 'company': 'Qorix Studio', 'location': 'Казань, Республика Татарстан, Россия · Remote', 'emp_type': 'full-time'}]","[{'start_date': '2020-04-06', 'end_date': '2020-10-06', 'school': 'Innopolis University', 'degree': 'Additional education, Industrial development with javascript'}, {'start_date': '2011-09-06', 'end_date': '2015-05-06', 'school': 'Kazan Energy College', 'degree': 'Secondary special education, Power stations networks and systems'}]","[{'name': 'Koa', 'endorsements': 0, 'passed_assessment': None}, {'name': 'Next', 'endorsements': 0, 'passed_assessment': None}, {'name': 'Storybook', 'endorsements': 0, 'passed_assessment': None}, {'name': 'JavaScript', 'endorsements': 0, 'passed_assessment': True}, {'name': 'TypeScript', 'endorsements': 8, 'passed_assessment': None}, {'name': 'React', 'endorsements': 0, 'passed_assessment': True}, {'name': 'Redux', 'endorsements': 7, 'passed_assessment': None}, {'name': 'Material UI', 'endorsements': 6, 'passed_assessment': None}, {'name': 'HTML', 'endorsements': 7, 'passed_assessment': True}, {'name': 'CSS', 'endorsements': 4, 'passed_assessment': True}, {'name': 'SCSS/SASS', 'endorsements': 4, 'passed_assessment': None}, {'name': 'Redux Saga', 'endorsements': 3, 'passed_assessment': None}, {'name': 'Разработка клиентской стороны', 'endorsements': 0, 'passed_assessment': True}, {'name': 'Testing Library', 'endorsements': 2, 'passed_assessment': None}, {'name': 'Jest', 'endorsements': 5, 'passed_assessment': None}, {'name': 'Scrum', 'endorsements': 2, 'passed_assessment': None}, {'name': 'Ant Design', 'endorsements': 5, 'passed_assessment': None}, {'name': 'jQuery', 'endorsements': 6, 'passed_assessment': None}]","[{'title': 'EF SET English Certificate 53/100 (B2 Upper Intermediate)', 'issuer': 'EF SET', 'date_issued': 'Dec 2022', 'cert_id': None, 'cert_link': 'https://www.efset.org/cert/t8w7kK'}]","['Английский', 'Русский']",,,https://media.licdn.com/dms/image/v2/C4E03AQFhi_0BkhddHg/profile-displayphoto-shrink_800_800/profile-displayphoto-shrink_800_800/0/1656760759440?e=1749686400&v=beta&t=UwLML5KFC4aCxPX7ynEEhR-ol1KztF43e017889ogRU,,,,[],['https://t.me/Lenar_E'],,
manual,ACoAAAHlL8kBnx7h8tZtgxoea3KRIYpoqJuNnoA,31797193,https://www.linkedin.com/in/abdelfattah-saleh-1a1795a,abdelfattah-saleh-1a1795a,abdelfattah Saleh,abdelfattah,Saleh,Egypt,Strategy & Technology | Data Analytics | Artificial Intelligence,45.0,938,932,0,no,False,False,False,False,False,Strategy & Technology,UltraHire,Self-employed,Swiftell,Udacity,DataCamp,3G,GSM,UMTS,"Over 20 Years of experience, I have managed to balance between holding different Technical & management roles in Multinational corporates such as Huawei & Orascom Telecom. including many technical fields such as mobile networks, data networks, VoIP, SMS, Data science, ML & AI.  Aside being a professional Telecom expert, I participated in telecom training industry and worked as an instructor in many institutes. Since I acquired my BSc in Telecom, I have the passion & curiosity to always explore the new technologies, master it then apply it to the entity.","[{'start_date': '2021-09-06', 'end_date': None, 'duration': '3 yrs 8 mos', 'title': 'Strategy & Technology', 'company': 'UltraHire', 'location': 'Cairo, Egypt · On-site', 'emp_type': 'self-employed'}, {'start_date': '2021-04-06', 'end_date': None, 'duration': '4 yrs 1 mo', 'title': 'ICT Management & Technical consultant', 'company': 'Self-employed', 'location': None, 'emp_type': None}, {'start_date': '2020-01-06', 'end_date': '2021-03-06', 'duration': '1 yr 3 mos', 'title': 'Operations Manager', 'company': 'Swiftell', 'location': 'Cairo, Egypt', 'emp_type': 'full-time'}, {'start_date': '2016-08-06', 'end_date': '2020-12-06', 'duration': '4 yrs 5 mos', 'title': 'Technical Director', 'company': 'GTA Com Limited.', 'location': 'Dubai, United Arab Emirates', 'emp_type': 'full-time'}, {'start_date': '2014-08-06', 'end_date': '2016-07-06', 'duration': '2 yrs', 'title': 'Managing Director', 'company': 'Ultimate solutions LLC', 'location': 'Cairo, Egypt', 'emp_type': 'full-time'}, {'start_date': '2012-01-06', 'end_date': '2014-07-06', 'duration': '2 yrs 7 mos', 'title': '3G Radio Optimization consultant', 'company': 'Orascom Telecom-Koryolink', 'location': None, 'emp_type': 'contract'}, {'start_date': '2007-03-06', 'end_date': '2011-12-06', 'duration': '4 yrs 10 mos', 'title': 'Radio Frequency planning & optimization Expert', 'company': 'Huawei', 'location': 'Cairo, Egypt', 'emp_type': 'full-time'}]","[{'start_date': '2021-04-06', 'end_date': '2021-04-06', 'school': 'Udacity', 'degree': 'Certificate, Data science'}, {'start_date': '2021-04-06', 'end_date': '2021-04-06', 'school': 'Zero To Mastery Academy', 'degree': 'Certificate, Computer Programming'}, {'start_date': '2020-04-06', 'end_date': '2020-04-06', 'school': 'Innopolis University', 'degree': 'Certificate, Artificial Intelligence'}, {'start_date': '2020-04-06', 'end_date': '2020-04-06', 'school': 'Markov academy', 'degree': 'certificate, Artificial Intelligence'}, {'start_date': '2020-04-06', 'end_date': '2020-04-06', 'school': 'Udacity', 'degree': 'Certificate, Data Science'}, {'start_date': '2019-04-06', 'end_date': '2020-04-06', 'school': 'Udemy', 'degree': 'Certificate, Business Administration and Management, General'}, {'start_date': '2005-04-06', 'end_date': '2010-04-06', 'school': 'Huawei technologies', 'degree': 'Certificate, Telecommunications Engineering'}, {'start_date': '1998-04-06', 'end_date': '2003-04-06', 'school': 'Helwan University Cairo', 'degree': ""Bachelor's degree, Telecommunications Engineering""}, {'start_date': '2021-10-06', 'end_date': None, 'school': 'Udacity', 'degree': 'Certification, Machine learning'}, {'start_date': '2022-06-06', 'end_date': '2022-06-06', 'school': 'LinkedIn', 'degree': None}, {'start_date': '2022-07-06', 'end_date': '2022-07-06', 'school': 'DataCamp', 'degree': 'Consultant, Data Processing'}]","[{'name': 'Technical Support', 'endorsements': 0, 'passed_assessment': None}, {'name': 'Analytical Skills', 'endorsements': 0, 'passed_assessment': None}, {'name': 'Optimization', 'endorsements': 9, 'passed_assessment': None}, {'name': '3G', 'endorsements': 23, 'passed_assessment': None}, {'name': '2G', 'endorsements': 9, 'passed_assessment': None}, {'name': 'Telecommunications', 'endorsements': 5, 'passed_assessment': None}, {'name': 'GSM', 'endorsements': 13, 'passed_assessment': None}, {'name': 'RF Planning', 'endorsements': 4, 'passed_assessment': None}, {'name': 'UMTS', 'endorsements': 11, 'passed_assessment': None}, {'name': 'WCDMA', 'endorsements': 4, 'passed_assessment': None}, {'name': 'Optimizations', 'endorsements': 0, 'passed_assessment': None}, {'name': 'TEMS', 'endorsements': 0, 'passed_assessment': None}, {'name': 'Network Optimization', 'endorsements': 3, 'passed_assessment': None}, {'name': 'Actix', 'endorsements': 0, 'passed_assessment': None}, {'name': 'Wireless', 'endorsements': 0, 'passed_assessment': None}, {'name': 'Voice over IP (VoIP)', 'endorsements': 0, 'passed_assessment': None}, {'name': 'Python (Programming Language)', 'endorsements': 0, 'passed_assessment': None}, {'name': 'SMS', 'endorsements': 0, 'passed_assessment': None}, {'name': 'Provisioning', 'endorsements': 0, 'passed_assessment': None}, {'name': 'Data Analysis', 'endorsements': 0, 'passed_assessment': None}, {'name': 'Machine Learning', 'endorsements': 0, 'passed_assessment': None}, {'name': 'Deep Learning', 'endorsements': 0, 'passed_assessment': None}, {'name': 'Artificial Intelligence (AI)', 'endorsements': 0, 'passed_assessment': None}, {'name': 'SQL', 'endorsements': 0, 'passed_assessment': None}]","[{'title': 'Coursera-Machine learning Specialization', 'issuer': 'Coursera', 'date_issued': 'Nov 2022', 'cert_id': 'DPFLLUD897KG', 'cert_link': 'https://www.coursera.org/account/accomplishments/specialization/DPFLLUD897KG'}, {'title': 'Coursera-Unsupervised learning, Recommender system, Reinforcement learning', 'issuer': 'Coursera', 'date_issued': 'Nov 2022', 'cert_id': 'SN9Q4VZAWBUV', 'cert_link': 'https://coursera.org/verif y/SN9Q4VZAWBUV'}, {'title': 'Advanced Learning Algorithms', 'issuer': 'Coursera', 'date_issued': 'Oct 2022', 'cert_id': 'UM5VDCGJRDRZ', 'cert_link': 'https://www.coursera.org/account/accomplishments/certificate/UM5VDCGJRDRZ'}, {'title': 'Supervised Machine Learning: Regression and Classification', 'issuer': 'Coursera', 'date_issued': 'Sep 2022', 'cert_id': 'TC6DDM3ZXRVC', 'cert_link': 'https://www.coursera.org/account/accomplishments/certificate/TC6DDM3ZXRVC'}, {'title': 'AWS Machine Learning Foundations', 'issuer': 'Udacity', 'date_issued': 'Oct 2021', 'cert_id': None, 'cert_link': None}]",[],,,,https://media.licdn.com/dms/image/v2/C4D16AQHqvxf6xyGzZw/profile-displaybackgroundimage-shrink_350_1400/profile-displaybackgroundimage-shrink_350_1400/0/1621295889274?e=1749686400&v=beta&t=rRJHqyys4AeG2FravzEK-PzjXSN8ZNhCI51c7bVXOkg,,,[],[],,
manual,ACoAABsQnuEB8LhO9T97xH6nBr8vXcVyULW0uGQ,454074081,https://www.linkedin.com/in/navruza-tulkunova-42909a108,navruza-tulkunova-42909a108,Navruza Tulkunova,Navruza,Tulkunova,"Tashkent, Uzbekistan",CEO & Founder | Fermopolis,32.0,255,252,0,no,False,False,False,False,False,Chief Executive Officer,FERMOPOLIS,Speed and Function,"United Soft, LLC",Innopolis University,Innopolis University,Manufacturing Process Improvement,Communication,Scopes Of Work,"A dynamic and accomplished professional with over 7 years of robust project management experience, I bring a wealth of expertise to the table. Throughout my career, I have consistently demonstrated a keen ability to lead and navigate complex projects, ensuring their successful completion within scope, time, and budget constraints. My project management skills are underpinned by a solid foundation in computer science, further enriched by my current pursuit of a Ph.D. in the field.","[{'start_date': '2023-03-06', 'end_date': None, 'duration': '2 yrs 2 mos', 'title': 'Chief Executive Officer', 'company': 'FERMOPOLIS', 'location': 'Innopolis · On-site', 'emp_type': None}, {'start_date': '2019-06-06', 'end_date': '2023-07-06', 'duration': '4 yrs 2 mos', 'title': 'Head of Project Management', 'company': 'Speed and Function', 'location': 'Philadelphia, Pennsylvania, United States · Remote', 'emp_type': 'full-time'}, {'start_date': '2015-10-06', 'end_date': '2016-08-06', 'duration': '11 mos', 'title': 'Project Manager', 'company': 'United Soft, LLC', 'location': 'Uzbekistan, Tashkent · On-site', 'emp_type': 'full-time'}, {'start_date': '2013-09-06', 'end_date': '2014-05-06', 'duration': '9 mos', 'title': 'Project Manager', 'company': 'Asian Development Bank', 'location': 'Uzbekistan, Tashkent', 'emp_type': None}, {'start_date': '2011-10-06', 'end_date': '2012-09-06', 'duration': '1 yr', 'title': 'Intern at the Department for cooperation with the UN and other international organisations', 'company': 'Ministry of Foreign Affairs of the Republic of Uzbekistan', 'location': 'Uzbekistan · On-site', 'emp_type': 'internship'}]","[{'start_date': '2023-09-06', 'end_date': '2026-08-06', 'school': 'Innopolis University', 'degree': 'Doctor of Philosophy - PhD, Computer Science'}, {'start_date': '2016-04-06', 'end_date': '2018-04-06', 'school': 'Innopolis University', 'degree': 'Master of Science - MS, Software Engineering'}, {'start_date': '2011-04-06', 'end_date': '2015-04-06', 'school': 'University of Westminster', 'degree': 'Bachelor of Science (B.S.), Business Information Systems'}]","[{'name': 'Manufacturing Process Improvement', 'endorsements': 2, 'passed_assessment': None}, {'name': 'Communication', 'endorsements': 2, 'passed_assessment': None}, {'name': 'Scopes Of Work', 'endorsements': 0, 'passed_assessment': None}, {'name': 'Leadership', 'endorsements': 0, 'passed_assessment': None}, {'name': 'Coaching & Mentoring', 'endorsements': 0, 'passed_assessment': None}, {'name': 'Product Management', 'endorsements': 0, 'passed_assessment': None}, {'name': 'Project Management Office (PMO)', 'endorsements': 0, 'passed_assessment': None}, {'name': 'Software Project Management', 'endorsements': 0, 'passed_assessment': None}, {'name': 'Agile Methodologies', 'endorsements': 0, 'passed_assessment': None}, {'name': 'Scrum', 'endorsements': 0, 'passed_assessment': None}, {'name': 'Командная работа', 'endorsements': 0, 'passed_assessment': None}, {'name': 'Front end Development', 'endorsements': 0, 'passed_assessment': None}, {'name': 'Project management', 'endorsements': 0, 'passed_assessment': None}, {'name': 'Agile-менеджмент', 'endorsements': 0, 'passed_assessment': None}]","[{'title': 'ICAgile Certified Professional - Agile Team Facilitation', 'issuer': 'ICAgile', 'date_issued': 'Sep 2021', 'cert_id': '244-28246-779c97f5-d029-40f3-8ff5-47423bffc015', 'cert_link': 'https://www.icagile.com/credentials/779c97f5-d029-40f3-8ff5-47423bffc015'}]",[],,,https://media.licdn.com/dms/image/v2/C5603AQFuru9ISwyo_w/profile-displayphoto-shrink_800_800/profile-displayphoto-shrink_800_800/0/1629304542526?e=1749686400&v=beta&t=GNl4uXMB8G3oB-8NiUkhomf9wELmzsKjUxPiFj4-mZE,,,,[],[],,
manual,ACoAAC28QuYBfMqYU5h-WnPWREsGXx6qsHnFm1o,767312614,https://www.linkedin.com/in/azat-bariev-79ab7a194,azat-bariev-79ab7a194,Azat Bariev,Azat,Bariev,Russia,Junior developer,24.0,5,5,0,no,False,False,False,False,False,Инженер-программист,Маркетплейс KazanExpress,-,FIX Group of Companies,Innopolis University,,Английский язык,Разработка игр,Python,,"[{'start_date': '2024-04-06', 'end_date': None, 'duration': '1 yr 1 mo', 'title': 'Инженер-программист', 'company': 'Маркетплейс KazanExpress', 'location': 'Иннополис, Республика Татарстан, Россия · On-site', 'emp_type': 'full-time'}, {'start_date': '2022-10-06', 'end_date': None, 'duration': '2 yrs 7 mos', 'title': 'Unity Developer', 'company': '-', 'location': 'Remote', 'emp_type': 'freelance'}, {'start_date': '2021-08-06', 'end_date': '2022-08-06', 'duration': '1 yr 1 mo', 'title': 'Junior developer', 'company': 'FIX Group of Companies', 'location': None, 'emp_type': None}]","[{'start_date': '2019-04-06', 'end_date': '2023-04-06', 'school': 'Innopolis University', 'degree': ""Bachelor's degree, Компьютерные науки""}]","[{'name': 'Английский язык', 'endorsements': 0, 'passed_assessment': None}, {'name': 'Разработка игр', 'endorsements': 0, 'passed_assessment': None}, {'name': 'Python', 'endorsements': 0, 'passed_assessment': None}, {'name': 'Git', 'endorsements': 0, 'passed_assessment': None}, {'name': 'Linux', 'endorsements': 0, 'passed_assessment': None}, {'name': 'Docker', 'endorsements': 0, 'passed_assessment': None}, {'name': 'Java', 'endorsements': 0, 'passed_assessment': None}, {'name': 'Unity', 'endorsements': 0, 'passed_assessment': True}, {'name': 'C#', 'endorsements': 0, 'passed_assessment': None}, {'name': 'Docker compose', 'endorsements': 0, 'passed_assessment': None}]","[{'title': 'IELTS Academic Certificate', 'issuer': 'British Council for IELTS', 'date_issued': 'Jan 2025 · Expires Jan 2027', 'cert_id': '24KZ518686BARA001A', 'cert_link': None}]",[],,,https://media.licdn.com/dms/image/v2/C5603AQGaDo7X2BVFLg/profile-displayphoto-shrink_800_800/profile-displayphoto-shrink_800_800/0/1570631116810?e=1749686400&v=beta&t=DINl7gDUmSXtKW7etp-8cWen2JgxOeAu9OtsTvkO5Oc,,,,[],[],,
